{
  "$schema": "urn:openaix:schema:measure-volume:0.2.0-draft.1",
  "active": {
    "end": "2026-10-02T15:00:00Z",
    "start": "2026-10-02T13:00:00Z"
  },
  "channels": [
    "banshee-uhf"
  ],
  "components": [
    {
      "active": {
        "end": "2026-10-02T15:00:00Z",
        "start": "2026-10-02T13:00:00Z"
      },
      "extensions": {
        "org.cjtf-oir.ato": {
          "ato_day": "214"
        }
      },
      "geometry": {
        "kind": "polygon",
        "rings": [
          [
            {
              "latitude": 35.035,
              "longitude": 39.825
            },
            {
              "latitude": 35.035,
              "longitude": 40.175
            },
            {
              "latitude": 35.335,
              "longitude": 40.175
            },
            {
              "latitude": 35.335,
              "longitude": 39.825
            },
            {
              "latitude": 35.035,
              "longitude": 39.825
            }
          ]
        ]
      },
      "id": "basin-main",
      "lower_limit": {
        "surface": true
      },
      "maximum_limit": {
        "reference": "MSL",
        "unit": "ft",
        "value": 18000
      },
      "minimum_limit": {
        "reference": "AGL",
        "unit": "ft",
        "value": 500
      },
      "name": "Objective area",
      "operation": "add",
      "upper_limit": {
        "reference": "MSL",
        "unit": "ft",
        "value": 17000
      }
    },
    {
      "active": {
        "end": "2026-10-02T15:00:00Z",
        "start": "2026-10-02T13:00:00Z"
      },
      "geometry": {
        "center": {
          "latitude": 35.195,
          "longitude": 40.075
        },
        "kind": "circle",
        "radius": {
          "unit": "nm",
          "value": 3
        }
      },
      "id": "lantern-cutout",
      "lower_limit": {
        "surface": true
      },
      "name": "Lantern exclusion",
      "operation": "subtract",
      "upper_limit": {
        "reference": "MSL",
        "unit": "ft",
        "value": 10000
      }
    }
  ],
  "controlling_agency": "banshee",
  "coordination_instructions": [
    "Check in on the Basin control frequency 10 nm before the boundary."
  ],
  "description": "High-density airspace control zone over the northern objective area, where helicopters, observation drones and fires are concentrated; the Lantern no-fly zone is cut out of it.",
  "extensions": {
    "org.cjtf-oir.ato": {
      "ato_day": "214"
    }
  },
  "id": "basin-hidacz",
  "name": "Basin HIDACZ",
  "notes": "Survivor last reported on the eastern edge; Pedro has on-scene command.",
  "purpose": "Coordinate the concentrated objective-area users under one controlling agency.",
  "resources_ref": {
    "id": "oir-resources",
    "revision": "1"
  },
  "restrictions": [
    "Enter only with a clearance from the Basin airspace control element."
  ],
  "type": "HIDACZ"
}
