{
  "$schema": "urn:openaix:schema:measure-volume:0.2.0-draft.1",
  "active": {
    "end": "2026-10-02T15:00:00Z",
    "start": "2026-10-02T13:00:00Z"
  },
  "components": [
    {
      "geometry": {
        "kind": "polygon",
        "rings": [
          [
            {
              "latitude": 35.035,
              "longitude": 39.825
            },
            {
              "latitude": 35.035,
              "longitude": 40.175
            },
            {
              "latitude": 35.335,
              "longitude": 40.175
            },
            {
              "latitude": 35.335,
              "longitude": 39.825
            },
            {
              "latitude": 35.035,
              "longitude": 39.825
            }
          ]
        ]
      },
      "id": "basin-main",
      "lower_limit": {
        "surface": true
      },
      "operation": "add",
      "upper_limit": {
        "reference": "MSL",
        "unit": "ft",
        "value": 17000
      }
    }
  ],
  "id": "basin-hidacz",
  "name": "Basin HIDACZ",
  "type": "HIDACZ"
}
